[
  {
    "id": "linear-rss-filter-notify",
    "category": "linear",
    "nl_description": "Fetch an RSS feed, filter articles that mention 'AI', and send matching titles to a Slack channel.",
    "expected_node_count": 3,
    "expected_node_names": ["rss", "filter", "notify"],
    "complexity": "low",
    "tags": ["source", "filter", "effect"],
    "contrastive": {
      "expected_function_count": 3,
      "key_behaviors": [
        "Fetches RSS feed from a URL",
        "Filters articles by keyword 'AI'",
        "Sends matching titles to Slack"
      ]
    }
  },
  {
    "id": "linear-csv-transform-store",
    "category": "linear",
    "nl_description": "Read a CSV file of transactions, convert amounts from USD to EUR using a fixed rate, and write the result to a new CSV.",
    "expected_node_count": 3,
    "complexity": "low",
    "tags": ["source", "transform", "effect"],
    "contrastive": {
      "expected_function_count": 3,
      "key_behaviors": [
        "Reads CSV input",
        "Converts USD amounts to EUR",
        "Writes output CSV"
      ]
    }
  },
  {
    "id": "linear-log-parse-report",
    "category": "linear",
    "nl_description": "Tail a web server access log, parse each line into structured request objects with method/path/status, and append a summary row to a daily report spreadsheet.",
    "expected_node_count": 3,
    "complexity": "low",
    "tags": ["source", "transform", "effect"],
    "contrastive": {
      "expected_function_count": 3,
      "key_behaviors": [
        "Tails access log file",
        "Parses log lines into structured request objects",
        "Appends summary to daily report"
      ]
    }
  },
  {
    "id": "linear-image-resize-upload",
    "category": "linear",
    "nl_description": "Watch a folder for new image uploads, resize each image to a 256x256 thumbnail, and upload the thumbnail to an S3 bucket.",
    "expected_node_count": 3,
    "complexity": "low",
    "tags": ["source", "transform", "effect"],
    "contrastive": {
      "expected_function_count": 3,
      "key_behaviors": [
        "Watches folder for new images",
        "Resizes images to 256x256 thumbnails",
        "Uploads thumbnails to S3"
      ]
    }
  },
  {
    "id": "linear-dns-lookup-cache-respond",
    "category": "linear",
    "nl_description": "Receive a DNS query, look up the domain in an authoritative nameserver, cache the result with TTL, and return the resolved IP to the client.",
    "expected_node_count": 4,
    "complexity": "medium",
    "tags": ["source", "lookup", "cache", "effect"],
    "contrastive": {
      "expected_function_count": 4,
      "key_behaviors": [
        "Receives incoming DNS query",
        "Looks up domain against authoritative nameserver",
        "Caches result with appropriate TTL",
        "Returns resolved IP to client"
      ]
    }
  },
  {
    "id": "linear-markdown-render-deploy",
    "category": "linear",
    "nl_description": "Watch a directory of Markdown files for changes, render each changed file to HTML with syntax highlighting, and deploy the updated pages to a static hosting bucket.",
    "expected_node_count": 3,
    "complexity": "low",
    "tags": ["source", "transform", "effect"],
    "contrastive": {
      "expected_function_count": 3,
      "key_behaviors": [
        "Watches Markdown files for changes",
        "Renders Markdown to HTML with syntax highlighting",
        "Deploys HTML to static hosting"
      ]
    }
  },
  {
    "id": "fanout-email-classify",
    "category": "fan-out",
    "nl_description": "Watch an email inbox. Classify each email as urgent, newsletter, or other. Route urgent emails to a priority list, newsletters to a weekly digest, and count the rest by sender.",
    "expected_node_count": 5,
    "expected_node_names": ["inbox", "classify", "urgent", "digest", "count"],
    "complexity": "medium",
    "tags": ["source", "classify", "fan-out", "effect"],
    "contrastive": {
      "expected_function_count": 5,
      "key_behaviors": [
        "Classifies emails into 3 categories",
        "Routes urgent to priority list",
        "Aggregates newsletters for weekly digest",
        "Counts remaining by sender"
      ]
    }
  },
  {
    "id": "fanout-iot-sensor-broadcast",
    "category": "fan-out",
    "nl_description": "Read a temperature sensor value from an IoT gateway. Simultaneously push the reading to a time-series database, update a real-time dashboard widget, and check if it exceeds a threshold to trigger an HVAC adjustment.",
    "expected_node_count": 5,
    "complexity": "medium",
    "tags": ["source", "fan-out", "effect", "threshold"],
    "contrastive": {
      "expected_function_count": 5,
      "key_behaviors": [
        "Reads temperature from IoT gateway",
        "Stores reading in time-series database",
        "Updates real-time dashboard widget",
        "Checks threshold and triggers HVAC adjustment"
      ]
    }
  },
  {
    "id": "fanout-order-fulfillment",
    "category": "fan-out",
    "nl_description": "When a new e-commerce order arrives, simultaneously reserve inventory in the warehouse system, charge the customer's payment method, and send an order confirmation email.",
    "expected_node_count": 4,
    "complexity": "medium",
    "tags": ["source", "fan-out", "effect"],
    "contrastive": {
      "expected_function_count": 4,
      "key_behaviors": [
        "Receives new order event",
        "Reserves inventory in warehouse",
        "Charges customer payment method",
        "Sends order confirmation email"
      ]
    }
  },
  {
    "id": "fanout-video-process",
    "category": "fan-out",
    "nl_description": "When a video is uploaded, simultaneously extract a thumbnail at the 5-second mark, generate a text transcript via speech-to-text, and create a low-resolution preview for mobile clients.",
    "expected_node_count": 4,
    "complexity": "medium",
    "tags": ["source", "fan-out", "transform"],
    "contrastive": {
      "expected_function_count": 4,
      "key_behaviors": [
        "Receives uploaded video",
        "Extracts thumbnail at 5-second mark",
        "Generates transcript via speech-to-text",
        "Creates low-resolution mobile preview"
      ]
    }
  },
  {
    "id": "fanout-deploy-notify",
    "category": "fan-out",
    "nl_description": "When a CI/CD pipeline completes a build, simultaneously push the Docker image to a container registry, update the deployment manifest in the GitOps repo, send a Slack notification to the team, and tag the Git commit with the release version.",
    "expected_node_count": 5,
    "complexity": "medium",
    "tags": ["source", "fan-out", "effect", "devops"],
    "contrastive": {
      "expected_function_count": 5,
      "key_behaviors": [
        "Receives build completion event",
        "Pushes Docker image to registry",
        "Updates GitOps deployment manifest",
        "Sends Slack notification",
        "Tags Git commit with release version"
      ]
    }
  },
  {
    "id": "fanin-morning-brief",
    "category": "fan-in",
    "nl_description": "Fetch today's weather forecast, my calendar events, and current traffic conditions. Combine them into a single morning briefing message.",
    "expected_node_count": 4,
    "expected_node_names": ["weather", "calendar", "traffic", "brief"],
    "complexity": "medium",
    "tags": ["multi-source", "aggregate", "effect"],
    "contrastive": {
      "expected_function_count": 4,
      "key_behaviors": [
        "Fetches weather data",
        "Fetches calendar events",
        "Fetches traffic conditions",
        "Combines all three into one briefing"
      ]
    }
  },
  {
    "id": "fanin-patient-summary",
    "category": "fan-in",
    "nl_description": "Pull a patient's lab results from the LIMS, current medications from the pharmacy system, and recent vitals from the nursing station. Merge them into a single pre-visit summary for the physician.",
    "expected_node_count": 4,
    "complexity": "medium",
    "tags": ["multi-source", "aggregate", "healthcare"],
    "contrastive": {
      "expected_function_count": 4,
      "key_behaviors": [
        "Fetches lab results from LIMS",
        "Fetches current medications from pharmacy system",
        "Fetches recent vitals from nursing station",
        "Merges into pre-visit physician summary"
      ]
    }
  },
  {
    "id": "fanin-social-sentiment",
    "category": "fan-in",
    "nl_description": "Collect mentions of a brand from Twitter, Reddit, and Hacker News simultaneously. Aggregate all mentions into a unified sentiment score with source attribution.",
    "expected_node_count": 4,
    "complexity": "medium",
    "tags": ["multi-source", "aggregate", "sentiment"],
    "contrastive": {
      "expected_function_count": 4,
      "key_behaviors": [
        "Collects brand mentions from Twitter",
        "Collects brand mentions from Reddit",
        "Collects brand mentions from Hacker News",
        "Aggregates into unified sentiment score with attribution"
      ]
    }
  },
  {
    "id": "fanin-fraud-scoring",
    "category": "fan-in",
    "nl_description": "For each credit card transaction, simultaneously check the IP geolocation, the card's velocity history, and the merchant risk category. Combine these signals into a single fraud risk score.",
    "expected_node_count": 5,
    "complexity": "high",
    "tags": ["multi-source", "aggregate", "finance", "scoring"],
    "contrastive": {
      "expected_function_count": 5,
      "key_behaviors": [
        "Receives credit card transaction",
        "Checks IP geolocation",
        "Checks card velocity history",
        "Checks merchant risk category",
        "Combines signals into fraud risk score"
      ]
    }
  },
  {
    "id": "fanin-infrastructure-health",
    "category": "fan-in",